slide_id,role,claim,source_artifact,sample_or_scope,uncertainty_or_caveat,privacy_status,visual,interpretation_boundary,risk,action
1,title,AI算力基础设施与经济增长：跨国面板证据,not_applicable,185国 × 2015–2023,not_applicable,cleared,title + setting,not_applicable,none,create
2,motivation,"全球AI算力8年增长15.7倍；TOP500总算力从391 PFlops升至6,137 PFlops",docs/compute_capacity_feasibility.md (global trend table),"65期TOP500数据, 1993–2025",仅TOP500超算，不含云算力,cleared,趋势折线图,不声称全面测量所有AI算力,none,create
3,question,AI算力基础设施扩张是否促进国家经济增长？,docs/research_starter_packet.md (RQ),185国 × 2015–2023,投入增加可能是经济增长的结果而非原因,cleared,research question,因果识别仅限于关联层面,none,create
4,data,"分析样本：120国 × 9年 = 1,080完整观测；PWT 11.0 + WDI + TOP500","reports/validation_report.md, docs/data_inventory.md","1960+面板, 185国总; 2015+子面板",141国有零算力值（无TOP500系统）,cleared,sample flow / data source diagram,主要分析基于有非零算力的44国,overload,create
5,design,双向固定效应 + 连续处理强度：log_total_rmax_lag1 对 growth_annual,reports/did_diagnostics_report.html (§Design caveat),"120国, 2015–2023, FE模型",非干净staggered D… 34/44始终受处理；9个后进入者,cleared,设计图（FE结构 + 连续变量）,不能声称DID因果识别；主识别为连续FE模型,overclaim,create
6,design,渠道分解：自动化渠道(产业份额交互) vs 新任务渠道(人力资本交互),docs/research_starter_packet.md (§回归设定),"1059 obs, channel interaction model",渠道代理变量为间接测量；交互项系数不解释因果中介,cleared,交互项模型图,不声称任务层面机制；不声称因果中介,overclaim,create
7,result,"主效应：log_total_rmax 系数 = −0.062, p = 0.066","reports/table1_main_effect.html (col 1), reports/did_diagnostics_report.html","1,080 obs, 120国, FE+聚类SE",p=0.066在5%水平不显著；只有44国有非零算力,cleared,coefficient card + mini table,边际显著，不可声称确定效果,unsupported claim,create
8,result,稳健性：排除中国/排除OECD/排除极端增长后系数稳定(−0.063 ~ −0.001),reports/table1_main_effect.html (cols 2–4),"col 2: 1071 obs, col 3: 765 obs (非OECD), col 4: 1077 obs","col 3系数=0.001, 非OECD子样本无显著效应",cleared,forest plot of 4 columns,不应选择性报告显著子样本,none,create
9,robustness,系数字稳性：嵌套模型下 −0.077 → −0.062，加入控制变量不消除负关联,reports/did_diagnostics_report.html (§7 coefficient stability),4 nested specifications,负关联的符号稳定但量略有衰减,cleared,coef_stability.png,关联稳定但不意味识别有效,none,verify
10,robustness,Placebo检验：log_total_rmax随机置换 → 分布远→ p = 0.001,"reports/did_diagnostics_report.html (§6 placebo), placebo_continuous.png","1,080 obs, 120国, 2000次置换",随机置换检验仅排除零假设，不识别因果效应,cleared,placebo_continuous.png,p值不解释为因果强度,overclaim,verify
11,result,渠道交互：三部门份额交互项系数均不显著，方向为负或为零,reports/table2_channel.html,"1059 obs, interaction model",三个交互项均无统计显著性；服务业/工业系数近乎为零,cleared,compact table,当前代理变量下无法区分渠道,none,create
12,design,事件研究（仅诊断）：pre-trend弱，仅9国可观测进入时间,"reports/did_diagnostics_report.html (§2 event study), event_study_twfe.png","44 treated countries, 9 late entrants","pre-trend检验效力低（4个前期+, 9个后进入者）",cleared,event_study_twfe.png,事件研究仅诊断性用途；不可声称平行趋势,overclaim,create
13,limitation,方法局限：不足50个聚类、内生性未解决、测量范围不匹配,docs/methods_review_issues.csv (ISSUE-001 through ISSUE-012),"185国 × 2015–2023, 12方法议题覆盖",每个问题有独立不确定性边界,cleared,checklist / table,不声称这些问题已解决,none,create
14,discussion,证据总结：连续算力与增长呈弱负相关，渠道分解未识别主导机制,all tables + methods_review_issues.csv,Full evidence trail,所有结论以agent验证证据为基础,cleared,evidence-gap table,不声称政策含义；不声称因果,overclaim,create
15,discussion,下一步：寻找外生冲击、改进代理变量、扩展OEC/云算力数据,"docs/research_starter_packet.md (§Next Skill Route), docs/compute_capacity_feasibility.md",Full route card set,三个计划步骤各有失败信号,cleared,roadmap slide,不声称中期里程碑为已完成,none,create
